### ISSUE TITLE
issue with containers communicating with each other on same host

### ISSUE THREAD

**Issue by shmurthy62** [gopher-net/ipvlan-docker-plugin#6]
I have experimental docker (Version : 1.9.0-dev) installed and I deployed ip-vlan-docker-plugin driver on my host after building it myself.

I start my driver as follows

./main --gateway=172.200.0.1 --ipvlan-subnet=172.200.0.0/22 --host-interface=em1 --mode=l2

it starts up fine. Then I launch 2 containers on this host both running busybox. It starts up fine and gets IP addresses assigned and I can see the routes are added to the route table in the container. I am pasting the output of "route -n" below from one of the containers. Both look same. 

 # route -n
Kernel IP routing table
Destination     Gateway         Genmask         Flags Metric Ref    Use Iface
0.0.0.0         172.200.0.1     0.0.0.0         UG    0      0        0 eth0
172.200.0.0     0.0.0.0         255.255.252.0   U     0      0        0 eth0

What I am finding is that I am unable to ping one container from the other container on the same host. However if I start another container on a remote host in another subnet, I am able to reach it without any issues. I know from a container I cannot reach host interface. However I expected that containers within the same host should be able to communicate with each other.  

I decided to test this outside the docker ecosystem as follows

// create first name space and provision it

ip netns add ns0
ip link add link em1 ipvl0 type ipvlan mode l2
ip link set dev ipvl0 netns ns0
ip netns exec ns0 bash
ip link set dev ipvl0 up
ip -4 addr add 172.200.0.24/22 dev ipvl0
ip -4 route add default via 172.200.0.1 dev ipvl0

root@ubuntu:~# route -n
Kernel IP routing table
Destination     Gateway         Genmask         Flags Metric Ref    Use Iface
0.0.0.0         172.200.0.1     0.0.0.0         UG    0      0        0 ipvl0
172.200.0.0     0.0.0.0         255.255.252.0   U     0      0        0 ipvl0

// create a second name space 
ip netns add ns1
ip link add link em1 ipvl1 type ipvlan mode l2
ip link set dev ipvl1 netns ns1
ip netns exec ns1 bash
ip link set dev ipvl1 up
 ip -4 addr add 172.200.0.35/22 dev ipvl1
ip -4 route add default via 172.200.0.1 dev ipvl1

Both these namespaces are on the same host and I have no problem pinging the interfaces in each of these namespaces from the bash shell in the other namespace.

Problem seems to be with only the docker container. Has anybody else experienced similar problems?

**Comment by shmurthy62** [comment]
I have narrowed this down to the fact that the container stack does not respond to arp requests. ARP seems to be disabled on the IPVLAN interface in the container. This cannot be an issue with the IPVLAN kernel driver as it works correctly in the name space example I posted. There is something with docker and IPVLAN that is not setup correctly.

**Comment by shmurthy62** [comment]
after disabling arp on the interface in the namespace by issuing "ifconfig ipvl0 -arp" I was able to reproduce this issue in name space too. So docker seems to be disabling arp on the eth0 (IPVLAN) interface assigned to the container. I would like to know how to make docker not disable arp.

**Comment by nerdalert** [comment]
Hey @shmurthy62 ! Sorry for the delay, I will dig into it tonight. I remember seeing that issue also with L2 mode. Im wondering if its a hairpin issue or how the iface is setup. Thanks a bunch for verifying it should work with iproute2 commands. Thats awesome!

**Comment by shmurthy62** [comment]
It's definitely an ARP issue. BTW I could not get L3 mode to work at all. I will first make it work with iproute2 and then debug the issue with ipvlanplugin driver. Important thing is to understand if docker shuts off arp on the interface. So far I have scanned through libnetwork code and I have not come across code that turns off arp so far. May be I missed something.

**Comment by nerdalert** [comment]
Hi shmurthy62, I am a huge fan of L3 mode because it doesn't need any responders for ARP. I was scratching my head at first w/ L3 mode because I wasn't able to ping the ipvlan interface from the master interface (eth) and had them on the same subnet, different subnet, etc. I finally poked thru the netlink patch and saw everything from the head end of the interface pair (default ns eth0 for example) is filtered. So the cool thing is the underlying host is isolated from the namespace iface IP which makes sense for providers wanting a transparent underlying infra. So by design a namespace shouldn't be able to talk to the default namespace IP and ARP/Multicast is also filtered out.

The trick with IPVlan is you need a route to the namespace that the IPVlan tail is attached to from the default namespace that ingress traffic would come into the master interface. Those should be separate subnets between default namespace and container namespace, thus L3 mode. The plugin should include that route, but since it is single host it will not add the route to other namespaces on other hosts. Something would need to distribute that. Could be a k/v store or any other distribution mechanism. I played around with using Git since there is an interesting logging/accounting property to bootstrapping or for example something I am very interested in using a routing protocol to distribute route/nexthop since those are well known and understood with to massive scale. Here is an example [nerdalert/bgp-ipvlan-docker ](https://github.com/nerdalert/bgp-ipvlan-docker) of distributing the routes if interested. /32 routes with BGP + IPVlan is probably the cleanest and least amount of things that can break with no ARP and a solid BGP FSM for packet forwarding. Lemme know if you get stuck and I will gist the output to be clearer on the routes for multihost.

**Comment by shmurthy62** [comment]
Hi Brent,

Thanks for looking in to this for me. From what you are telling me L2 mode is not usable at all. How do you explain what I did with iproute2 and namespaces. In that case ARP is enabled on the interface in the name space with IPVLAN l2 mode. Is the GO netlink library disabling this. The L2 mode is quite simple if ARP is enabled. If we could optionally get (ip link set ${interface name} arp on) supported in the netlink package - we can set this up through the ipvlan plugin driver.

If I understand you correctly L3 mode will require a BGP instance on each host - very similar to Calico solution. I will follow your suggestion and pursue L3. If we have to run BGP instance on each host and if the number of nodes is in 1000's it would be a nightmare to manage BGP and triage issues. In any case I will test this out.

**Comment by nerdalert** [comment]
Hey shmurthy62, L2 should be usable, sorry was just talking about L3. I went to test it and ran into the latest GetCapabilities patch [PR #516](https://github.com/docker/libnetwork/pull/516/files#r39363560). Opened issue #7 to fix it. So I can't test it atm but will tomorrow. On the IPVlan there shouldn't be any filtering above netlink so Im betting its just something setup wrong in the L2 mode here. 

L3 mode would just require something to distribute network route and nexthop. L2 mode does this discovery with flooding and learning of mac addresses, L3 mode cares not for ethernet addresses since that is hidden away and the namespace is an altogether separate subnet from the default namespace. So distributing those routes would have to occur in some form or fashion, whether its etcd, bgp, zookeeper etc. If the environment is completely static then just declare it one time, burn it into the infra pointers and forget it but that takes a good crystal ball lol.

Good point on the clustering node count btw lol. In that case is a completely declarative model of a /23 or something per host that is static and routed out of a ToR make more sense? Or alternatively munging network state into orchestration clustering for packet forwarding? Something about keeping network state separate feels right to me.

Will update soon as I get issue #7 patched and verify L2 mode buddy. Thanks again for the help in getting this proofed out!

**Comment by nerdalert** [comment]
@shmurthy62 I updated with the libnetwork API changes and verified L2 ipvlan mode. Pasting in a screenshot that shows two containers on the same docker host pinging one another. Lemme know if that doesn't work in your environment and I will try and replicate. I tested on two different hosts so it seems g2g. Cheers.

![](http://networkstatic.net/wp-content/uploads/2015/09/Screenshot-2015-09-26-06.31.58.png)

**Comment by shmurthy62** [comment]
Does not work for me - I am trying to ping container on same host.

ubuntu@ubuntu-1:~$ sudo docker run -i -t --rm ubuntu /bin/bash
[sudo] password for ubuntu:
root@027397c45225:/# ifconfig
eth0      Link encap:Ethernet  HWaddr 00:26:55:82:4f:1c
          inet addr:172.200.0.3  Bcast:0.0.0.0  Mask:255.255.252.0
          inet6 addr: fe80::226:55ff:fe82:4f1c/64 Scope:Link
          UP BROADCAST RUNNING MULTICAST  MTU:1500  Metric:1
          RX packets:1 errors:0 dropped:0 overruns:0 frame:0
          TX packets:3 errors:0 dropped:0 overruns:0 carrier:0
          collisions:0 txqueuelen:0
          RX bytes:100 (100.0 B)  TX bytes:258 (258.0 B)

lo        Link encap:Local Loopback
          inet addr:127.0.0.1  Mask:255.0.0.0
          inet6 addr: ::1/128 Scope:Host
          UP LOOPBACK RUNNING  MTU:65536  Metric:1
          RX packets:0 errors:0 dropped:0 overruns:0 frame:0
          TX packets:0 errors:0 dropped:0 overruns:0 carrier:0
          collisions:0 txqueuelen:0
          RX bytes:0 (0.0 B)  TX bytes:0 (0.0 B)

root@027397c45225:/# ping 172.200.0.2  // pinging another docker container on same host
PING 172.200.0.2 (172.200.0.2) 56(84) bytes of data.
From 172.200.0.3 icmp_seq=1 Destination Host Unreachable
From 172.200.0.3 icmp_seq=2 Destination Host Unreachable
From 172.200.0.3 icmp_seq=3 Destination Host Unreachable
From 172.200.0.3 icmp_seq=4 Destination Host Unreachable

^C
--- 172.200.0.2 ping statistics ---
12 packets transmitted, 0 received, +9 errors, 100% packet loss, time 11063ms

Now I ping my gw and can reach it

root@027397c45225:/# ping 172.200.0.1
PING 172.200.0.1 (172.200.0.1) 56(84) bytes of data.
64 bytes from 172.200.0.1: icmp_seq=1 ttl=64 time=0.389 ms
64 bytes from 172.200.0.1: icmp_seq=2 ttl=64 time=0.235 ms
64 bytes from 172.200.0.1: icmp_seq=3 ttl=64 time=0.230 ms
^C

Now going across the router to remote host - no issues

root@027397c45225:/# ping 172.201.0.101
PING 172.201.0.101 (172.201.0.101) 56(84) bytes of data.
64 bytes from 172.201.0.101: icmp_seq=1 ttl=63 time=0.185 ms
64 bytes from 172.201.0.101: icmp_seq=2 ttl=63 time=0.183 ms

remote host to this container - works because I pinged this host from container

ubuntu@ubuntu-3:~$ ping 172.200.0.3
PING 172.200.0.3 (172.200.0.3) 56(84) bytes of data.
64 bytes from 172.200.0.3: icmp_seq=1 ttl=63 time=0.311 ms
64 bytes from 172.200.0.3: icmp_seq=2 ttl=63 time=0.219 ms
^C
--- 172.200.0.3 ping statistics ---
2 packets transmitted, 2 received, 0% packet loss, time 999ms
rtt min/avg/max/mdev = 0.219/0.265/0.311/0.046 ms

However if I ping the other container which is on same host as container 172.200.0.3 it does not work because of arp not responding.

ubuntu@ubuntu-3:~$ ping 172.200.0.2
PING 172.200.0.2 (172.200.0.2) 56(84) bytes of data.
From 172.201.0.1 icmp_seq=1 Destination Host Unreachable
From 172.201.0.1 icmp_seq=2 Destination Host Unreachable
From 172.201.0.1 icmp_seq=3 Destination Host Unreachable

Not sure what is the issue - the ifconfig eth0 in the docker container shows arp is enabled but still it does 
not respond.

if I ping remote host 172.201.0.101 from container 172.0.0.2 then the router learns its mac - after that I can ping from either end. 

Not sure why it works for you and not me. I only have trouble with docker container and not with iproute2 and namespaces

I am using Ubuntu 14.04 and have deployed linux kernel 4.2

ubuntu@ubuntu-3:~$ uname -a
Linux ubuntu-3 4.2.0-040200-generic #201508301530 SMP Sun Aug 30 19:31:40 UTC 2015 x86_64 x86_64 x86_64 GNU/Linux

can you tell me your version.

Did something get fixed in netlink library in the last 2-3 weeks. My code ipvlan driver plugin code is that old.

**Comment by nerdalert** [comment]
Hey! Thanks for the info, super helpful. I think I had mentioned I had run into something similar and I was able to reproduce it. Definitely agree you are following the exactly right thing with checking with iproute commands like you did. Your logs sure do look like a hairpin issue on the localhost. 

Have you setup macvlan links on the host at all recently? Ive noticed that if a macvlan link is defined pointing to the same master interface as an ipvlan interface it won't create a link. Thats not relevant to your situation since the interface was created but I figured I would throw it out there.

Try this if you don't mind:  Check `/var/run/docker/netns/` for any orphaned but still mounted interfaces. Simply unmount and delete them. If you see anywhere `Device or resource busy` when doing netlink operations I've found that just means it is still mounted. 

```
(='o'=)[root@ub-148:~$]# ls /var/run/docker/netns/
38fc8c67f5b1  9497f5d26b60  ae74a60c0c58  bb93e56b138f  bf54688c9f24
(='o'=)[root@ub-148:~$]# umount /var/run/docker/netns/*
(='o'=)[root@ub-148:~$]# rm /var/run/docker/netns/*
```

Also might be worth checking syslogs and kernel msgs in case a clue is there if up to it:

```
# Example from my kernel logs (eth0 is the container side iface and eth1 is the host iface going into promiscuous):
$ dmesg
[Sun Sep 27 03:47:04 2015] device eth1 entered promiscuous mode
[Sun Sep 27 03:47:04 2015] device eth1 left promiscuous mode
[Sun Sep 27 03:47:04 2015] eth0: renamed from 17aff
[Sun Sep 27 03:47:04 2015] device eth1 entered promiscuous mode
```

Btw, what is the container output for `ip route`? Here is mine:

```
root@02b2713c9a97:/# ip route
default via 192.168.1.1 dev eth0
192.168.1.0/24 dev eth0  proto kernel  scope link  src 192.168.1.2
```

I put in the world's longest error message but it can really be a pita because all netlink says is the resource is busy. 

```
log.Error("Ensure there are no existing [ ipvlan ] type links and remove with 'ip link del <link_name>'," +
            " also check `/var/run/docker/netns/` for orphaned links to unmount and delete, then restart the plugin")
```

My host is just a bit newer but I was using the same kernel as you until y-day:

```
$ uname -a
Linux ub-148 4.3.0-040300rc1-generic #201509160642 SMP Wed Sep 16 10:44:16 UTC 2015 x86_64 x86_64 x86_64 GNU/Linux
$ cat /etc/lsb-release
DISTRIB_ID=Ubuntu
DISTRIB_RELEASE=15.04
DISTRIB_CODENAME=vivid
```

Apprec the digging in, we will get support upstream packaged natively relatively soon but getting the early issues knocked out is going to be helpful so thanks again. If still hitting issues we can irc it out Monday too if up for it realtime. Lastly I updated and versioned the repo with new API updates that will work with the latest docker experimental in case you update one, just update the other.

**Comment by shmurthy62** [comment]
HI Brent, really appreciate you spending so much time with me.

I did try out macvlan plugin driver before this on the same host - that worked great! I upgraded kernel to 3.19 first and then 4.2 to test IPVLAN. I rebooted the node before I started IPVLAN test and have rebooted the node several times after that. 

/var/run/docker/netns/ is clean. 

As far as my interface em1 going to promiscuous mode its because of running tcpdump atleast in my case.

Here's the routes in one of my container

root@18d9dd6a1343:/# ip route
default via 172.200.0.1 dev eth0
172.200.0.0/22 dev eth0  proto kernel  scope link  src 172.200.0.11

routes in another container

root@eca6f0e96791:/# ip route
default via 172.200.0.1 dev eth0
172.200.0.0/22 dev eth0  proto kernel  scope link  src 172.200.0.12

BTW the interesting thing is if I ping a namespace (setup outside of docker) from within any of these containers I get a response mainly because the namespace ipvlan interface responds to arp request.

// Here if you notice no arp reply for container to container pings
08:41:52.154021 ARP, Request who-has 172.200.0.12 tell 172.200.0.11, length 28
08:41:53.172414 ARP, Request who-has 172.200.0.12 tell 172.200.0.11, length 28
08:41:53.172412 ARP, Request who-has 172.200.0.12 tell 172.200.0.11, length 28
08:41:54.170021 ARP, Request who-has 172.200.0.12 tell 172.200.0.11, length 28
08:41:54.170020 ARP, Request who-has 172.200.0.12 tell 172.200.0.11, length 28
08:41:55.170024 ARP, Request who-has 172.200.0.12 tell 172.200.0.11, length 28
08:41:55.170022 ARP, Request who-has 172.200.0.12 tell 172.200.0.11, length 28

// now when I ping a namespace @ 172.200.0.77
08:42:32.368291 ARP, Request who-has 172.200.0.77 tell 172.200.0.11, length 28
08:42:32.368290 ARP, Request who-has 172.200.0.77 tell 172.200.0.11, length 28

// now when I ping a namespace @ 172.200.0.39
08:42:56.472324 ARP, Request who-has 172.200.0.39 tell 172.200.0.11, length 28
08:42:56.472322 ARP, Request who-has 172.200.0.39 tell 172.200.0.11, length 28

Thanks again for your help.

Sharad

**Comment by nerdalert** [comment]
Hey Sharad, its my pleasure and very helpful so its me that owes you the thanks. The routes look spot on. I was feeling your pain so installed a 14.10 VM and the one thing I ran into of significance was the Docker experimental version. The `wget -qO- https://experimental.docker.com/ | sh` doesn't have a manifest for v1.9.0-dev only up to v1.8. 

Unfortunately none of that clues me into the issue you are having. What getting the latest experimental fixed was provisioning the link with the latest libnetwork API changes. Good thing is this is going to motivate me to get a Vagrantfile together to share with you. I will work on it tomorrow evening and Im guilty of never actually doing one cause it seems every project I ever work on @dave-tucker always did the vagrantfile lol. So hopefully tomorrow'ish I will push one. Thanks again buddy and check out the docker version for 14.10 in the readme updates if you have a second tomorrow.

**Comment by shmurthy62** [comment]
Hi Brent,

I have some good news. I cleaned out /var/lib/docker/ from my nodes and after that everything works in l2 mode. I saw a few files under /var/lib/docker/containers/ hanging around from before. What exactly goes into this folder?

I will continue testing to make sure there are no false positives. However I see one more thing which has to do with stability. Once the libnetwork driver hits an issue like I give it a wrong subnet and it reports an error like network not found, I see that I have to restart docker also along with the plugin driver. I can create a separate issue for this if you like.

In the mean time I will start evaluating l3 mode. Did you by any chance try to setup an arp proxy on the host?

**Comment by shmurthy62** [comment]
Hi Brent,

I now have the latest ipvlan driver code deployed. L2 checked out fine with this code. However L3 does not work at all. This is a docker issue. L3 mode works fine with Linux name spaces and hence not a driver issue. BTW I have BGP installed on all hosts now to create a L3 mesh. 

Here are the logs from docker and ipvlan driver 

WARN[0000] Running experimental build
WARN[0000] Usage of loopback devices is strongly discouraged for production use. Please use `--storage-opt dm.thinpooldev` or use `man docker` to refer to dm.thinpooldev section.
INFO[0006] Option DefaultDriver: ipvlan
INFO[0006] Option DefaultNetwork: foo
INFO[0006] Firewalld running: false
WARN[0006] Your kernel does not support swap memory limit.
INFO[0006] Loading containers: start.

INFO[0006] Loading containers: done.
INFO[0006] Daemon has completed initialization
INFO[0006] Docker daemon                                 commit=a3b04de execdriver=native-0.2 graphdriver=devicemapper version=1.9.0-dev
INFO[0006] Listening for HTTP on unix (/var/run/docker.sock)
INFO[0613] POST /v1.21/containers/create
ERRO[0613] Handler for POST /v1.21/containers/create returned error: No such image: ubuntu:latest
ERRO[0613] HTTP Error                                    err=No such image: ubuntu:latest statusCode=404
INFO[0613] POST /v1.21/images/create?fromImage=ubuntu&tag=latest
INFO[0615] Image manifest for ubuntu:latest has been verified
INFO[0624] POST /v1.21/containers/create
INFO[0624] POST /v1.21/containers/015f1b6bbacc4164c2379bb874e8f40f9269435419199005137ca3d768584b30/attach?stderr=1&stdin=1&stdout=1&stream=1
INFO[0624] POST /v1.21/containers/015f1b6bbacc4164c2379bb874e8f40f9269435419199005137ca3d768584b30/start
INFO[0624] No non-localhost DNS nameservers are left in resolv.conf. Using default external servers : [nameserver 8.8.8.8 nameserver 8.8.4.4]
INFO[0624] IPv6 enabled; Adding default IPv6 external servers : [nameserver 2001:4860:4860::8888 nameserver 2001:4860:4860::8844]
WARN[0625] exit status 2
ERRO[0625] failed to umount /var/lib/docker/containers/015f1b6bbacc4164c2379bb874e8f40f9269435419199005137ca3d768584b30/shm: invalid argument
ERRO[0625] failed to umount /var/lib/docker/containers/015f1b6bbacc4164c2379bb874e8f40f9269435419199005137ca3d768584b30/mqueue: invalid argument
ERRO[0625] 015f1b6bbacc4164c2379bb874e8f40f9269435419199005137ca3d768584b30: Failed to umount ipc filesystems: failed to cleanup ipc mounts:
invalid argument
invalid argument
ERRO[0625] Error unmounting device 015f1b6bbacc4164c2379bb874e8f40f9269435419199005137ca3d768584b30: UnmountDevice: device not-mounted id 015f1b6bbacc4164c2379bb874e8f40f9269435419199005137ca3d768584b30
ERRO[0625] Handler for POST /v1.21/containers/015f1b6bbacc4164c2379bb874e8f40f9269435419199005137ca3d768584b30/start returned error: Cannot start container 015f1b6bbacc4164c2379bb874e8f40f9269435419199005137ca3d768584b30: [8] System error: failed to set gateway while updating gateway: file exists
ERRO[0625] HTTP Error                                    err=Cannot start container 015f1b6bbacc4164c2379bb874e8f40f9269435419199005137ca3d768584b30: [8] System error: failed to set gateway while updating gateway: file exists statusCode=500
INFO[0625] DELETE /v1.21/containers/015f1b6bbacc4164c2379bb874e8f40f9269435419199005137ca3d768584b30?v=1

ipvlan driver logs

DEBU[0000] The plugin absolute path and handle is [ /run/docker/plugins/ipvlan.sock ]
INFO[0000] Plugin configuration options are:
  container subnet: [10.1.2.0/24],
  container gateway: [<nil>],
  host interface: [eth0],
  mmtu: [1500],
  ipvlan mode: [l3]
INFO[0000] IPVlan network driver initialized successfully
DEBU[0039] Handshake completed
DEBU[0039] Capabilities exchange complete
DEBU[0039] /sbin/iptables, [--wait -C POSTROUTING -t nat -s 10.1.2.0/24 -j MASQUERADE]
DEBU[0039] /sbin/iptables, [--wait -I POSTROUTING -t nat -s 10.1.2.0/24 -j MASQUERADE]
DEBU[0039] Adding route for the local ipvlan subnet [ 10.1.2.0/24 ] in the default namespace using the specified host interface [ eth0]
DEBU[0039] The container subnet for this context is [ 10.1.2.0/24 ]
INFO[0039] Allocated container IP: [ 10.1.2.2/24 ]
DEBU[0039] Create endpoint response: &{Interface:{Address:10.1.2.2/24 AddressIPv6: MacAddress:7a:42:0a:01:02:02}}
DEBU[0039] Create endpoint a1541d7e9cc3011f3db3a290bebe3475220cb2b2040da8429dd08f1648a080e8 &{Interface:{Address:10.1.2.2/24 AddressIPv6: MacAddress:7a:42:0a:01:02:02}}
DEBU[0039] Endpoint info request: &{NetworkID:f5f6c109686af2e4caedfad7592b3049eedcabae6e5c0e90c8ea68fe8f9ae7d4 EndpointID:a1541d7e9cc3011f3db3a290bebe3475220cb2b2040da8429dd08f1648a080e8}
DEBU[0039] Endpoint info a1541d7e9cc3011f3db3a290bebe3475220cb2b2040da8429dd08f1648a080e8
DEBU[0039] Join request: &{NetworkID:f5f6c109686af2e4caedfad7592b3049eedcabae6e5c0e90c8ea68fe8f9ae7d4 EndpointID:a1541d7e9cc3011f3db3a290bebe3475220cb2b2040da8429dd08f1648a080e8 SandboxKey:/var/run/docker/netns/06971ada2598 Options:map[com.docker.network.generic:map[ChildEndpoints:<nil> ParentEndpoints:<nil>]]}
INFO[0039] Created ipvlan link: [ a1541 ] with a mode: [ l3 ]
DEBU[0039] Join response: &{Gateway: InterfaceName:{SrcName:a1541 DstName: DstPrefix:eth} StaticRoutes:[0xc82010d260]}
DEBU[0039] Join endpoint f5f6c109686af2e4caedfad7592b3049eedcabae6e5c0e90c8ea68fe8f9ae7d4:a1541d7e9cc3011f3db3a290bebe3475220cb2b2040da8429dd08f1648a080e8 to /var/run/docker/netns/06971ada2598
DEBU[0039] Leave request: &{NetworkID:f5f6c109686af2e4caedfad7592b3049eedcabae6e5c0e90c8ea68fe8f9ae7d4 EndpointID:a1541d7e9cc3011f3db3a290bebe3475220cb2b2040da8429dd08f1648a080e8 Options:map[]}
DEBU[0039] Leave f5f6c109686af2e4caedfad7592b3049eedcabae6e5c0e90c8ea68fe8f9ae7d4:a1541d7e9cc3011f3db3a290bebe3475220cb2b2040da8429dd08f1648a080e8
DEBU[0039] Delete endpoint request: &{NetworkID:f5f6c109686af2e4caedfad7592b3049eedcabae6e5c0e90c8ea68fe8f9ae7d4 EndpointID:a1541d7e9cc3011f3db3a290bebe3475220cb2b2040da8429dd08f1648a080e8}
DEBU[0039] Delete endpoint a1541d7e9cc3011f3db3a290bebe3475220cb2b2040da8429dd08f1648a080e8
DEBU[0039] The requested interface to delete [ a1541 ] was not found on the host: route ip+net: no such network interface
ERRO[0039] The requested interface to delete [ a1541 ] was not found on the host.

FYI I am running Linux L6430-1 4.2.1-040201-generic #201509211431 SMP Mon Sep 21 18:34:44 UTC 2015 x86_64 x86_64 x86_64 GNU/Linux

one of the things missing in this kernel version is aufs module - I still went ahead with testing - don't see issues in L2 mode. I know docker needs it but for now I need to get libnetwork working. I cannot understand why docker is trying to set gateway for L3 mode.

FYI in a namespace I add a default route as follows "ip route add 0.0.0.0/0 dev eth0". I only need this to get going. When I add the ip address for the ipvlan interface, I don't provide a mask with the address like in L2 mode and things work perfectly. 

Can you please look into this.

Sharad

**Comment by nerdalert** [comment]
Hey @shmurthy62 ! Apologies for the delay. Last week was crazy and have been working on a native driver for ipvlan/macvlan. Thanks in part to your great feedback I think we have enough of a PoC with the caveats to pursue pushing it upstream. The IPAM APIs are changing in experimental this week as it comes out of experimental, along with some minor others so I had to get that all rectified. I will ping you with the local branch I will probably just push here so we can collaborate with everyone easier as soon as Madhu's docker integration branch gets pushed into docker/docker feedback on the UX and functionality if you are up to it. Thanks for the help on getting this proofed out Sharad!

**Comment by shmurthy62** [comment]
Hi Brent,

I hope by "native driver" you mean it will not require external libnetwork driver plugin as it is today - we would prefer this model. The current model is too brittle and has reliability issues. After my experience with current network plugin architecture we are not comfortable with the solution and are looking at using docker with --net=none option and implementing our own solution which I am against. This would be an interim solve till we get something concrete from docker. However I would strongly recommend revisiting the current network plugin model - the plugin should not impact the operation of of docker and vice versa. 

I would be happy to test out your native driver and provide feedback.

I am looking for a functionality where we want to call a pre-processor in the name space before our application is executed in the docker container. 

Something like this 

ip netns exec <containerId> preProcessor
ip netns exec <containerId> myapp

So 2 images need to be fetched one after another and executed in the same order specified within the container.

Alternatively docker would take a fully qualified path to an application through a command line option and execute it in namespace before executing  application.

We want to hide this from the application developer who would write the docker file. Is there a way to achieve this today?

Once I start testing I would recommend we move the conversation to irc or skype so its more realtime.

**Comment by nerdalert** [comment]
Hey @shmurthy62 ! Having an in-tree driver is the goal. This was to shake out any early blockers which you have been super helpful with. The v1.9 API changes are merged for the most part so they will solidify. 

The API that is now out of experimental will leverage the `docker network` command. The `-d` lets you use multiple drivers since they are bundled into libnetwork without having to run a separate process or container.

Define a network and run some containers:

```
# Macvlan Bridge Mode
docker network  create  -d macvlan  --subnet=192.168.1.0/24 --gateway=192.168.1.1 macnet1
docker  run --net=macnet1 -it --rm ubuntu
# IPVlan L2 Mode:
docker network  create  -d ipvlan  --subnet=192.168.3.0/24 --gateway=192.168.3.1 ipvnet1
docker  run --net=ipvnet1 -it --rm ubuntu
```

Networks associated to different drivers simultaneously.

```
$ docker network ls
NETWORK ID          NAME                DRIVER
251bd9251032        bridge              bridge
42e5991a44de        macnet1          macvlan
51f32322a2c3         ipvnet1            ipvlan
96a466f03110        none                null
3535f2a67719        host                host
```

I agree the hard part of having an external driver are the failure scenarios and float in state. Having the generic port creations upstream will take care of the single host operations. From there we can plug in whatever we want externally for state distribution. Something like IPVlan L3 mode doesn't really have a single host implementation since it requires routes to be added to other nodes needing to reach the subnet residing only in the namespace. It could be Etcd, Consul, whatever someone wants if they prefer a distributed datastore approach, or another one I am excited about is the GoBGP implementation that could propagate host routes or a summary for a pod etc. Will likely do the L3 mode experimentation here if there aren't any objections since the ipvlan functionality will be out of the box without a remote driver.

The generic L2 use cases are super simple which is very attractive and something as simple as a ToR could route the L2 network getting plumbed up from a phy eth iface or a (m)LAG bonding. 

Will catch up with you, curious what your thoughts on L3 state distribution is too. The OSRG folks are super guys and I have been a fan of creating a Quagga replacement :)

**Comment by shmurthy62** [comment]
Thanks for considering making ipvlan a native driver. I would recommend sourcing config from a file - default could be /etc/docker/docker.conf. CLI options could override that. In production environment file is preferable. 

Re l2 mode:
One of the things I have done in our lab is to figure out default gw by parsing output of ip route. That way you are not forced to provision it. This might be a preferred way in nodes where we have only 1 nic. So if the default gw is not specified in config file you should figure it out. As far as IP address allocation is concerned you should delegate it to an IPAM. You can have a default IPAM within docker so people can run it standalone. In conf file, you provide a way to specify IPAM URL. However in a production environment, it should call out to an IPAM service to fetch an IP for the container and subnet mask. This should be a rest interface and the api could take a host IP and fetch an IP range or ip and subnet mask. This way both options are deployable. If you ask for a range you should maintain state (binding of IP to contianer ID) so you know what is allocated - this way you can reuse an IP once the container to which it was allocated has been removed. I have to admit that my thoughts are evolving in this area - might take a little time to firm up - but I would like to brainstorm with you guys on this. 

 I agree L2 is super simple and will definitely work for us. It however will not allow IP mobility as the IP addresses will have to fall in the host's subnet.

Re l3 mode:

The beauty of this solve is it gives IP mobility. For us IP mobility is a want not a must. I have setup a BGP mesh using quagga in our lab. My current setup bypasses docker networking but I still use dockers. I think all docker needs to do is to setup a default route 0.0.0.0/0 via the ipvlan interface. Then ask IPAM for an IP address. Leave it to IPAM to figure out what IP address to dole out. In this mode the containers can have IP addresses outside the host subnet. This will provide IP mobility. I have a BGP instance per host peering with a BGP RR (Quagga Route server is even better). The BGP RR is at the leaf and will peer with a BGP at the spine level. 

In my current lab setup I am actually assigning a subnet to each host for docker containers and advertising it through BGP. However what I want to test is to inject a route per container IP (/32 address) in to the linux kernel and let BGP advertise it. I picked Quagga mainly because I can make it accept routes from the kernel and advertise it. I do not know how to do this with GoBGP (let me know if you know how to do it). Ideally docker should insert and remove the routes from the kernel based on the container lifecycle. If you can do that you leave it to the system integrator then to figure out how to advertise that route.

I am currently prototyping this experience and will provide feedback once my thoughts are more concrete. L3 is a very complex setup and I want to make sure all failure modes are covered.

I would want you to consider providing a REST API to expose config, state and stats. This way controllers can expose this to an operator. This will be very useful in large setups.

**Comment by jc-m** [comment]
Brent,  
I have experienced the same issue mentioned above by Sharad in the L3 case. I found that the remote driver is making assumptions without delegating all the controls to the remote plugin. 
Our use case is to have pure routed network without bridging. The current implementation of L3 fails to create the default route with : 

```
Error response from daemon: Cannot start container 1c5b403b5e7e1f1627f1d33598fb9d7a5b045b6ccaacaa737a6a07580121df57: [8] System error: failed to set gateway while updating gateway: file exists
```

if the content of the join response is : 

```
    respIface := &netApi.InterfaceName{
        SrcName: tempName,
        DstPrefix: "eth",
    }
    sandboxRoute := netApi.StaticRoute{
        Destination: "0.0.0.0/0",
        RouteType:     1, // CONNECTED
        NextHop:    "",
    }
    resp := &netApi.JoinResponse{
        StaticRoutes: []netApi.StaticRoute{sandboxRoute},
        InterfaceName: respIface,
    }
```

The daemon takes additional liberties if you just return:

```
    respIface := &netApi.InterfaceName{
        SrcName: tempName,
        DstPrefix: "eth",
    }
    resp := &netApi.JoinResponse{
        InterfaceName: respIface,
    }
```

in which case it creates a bridged interface anyway on the default docker network ...

I would be interested to understand the future of the plugin model, and how to make this work.

**Comment by jc-m** [comment]
I found the origin of the problem and filed https://github.com/docker/libnetwork/issues/775
I've done limited testing for my use case and it seems to solve this problem.

**Comment by prateekgogia** [comment]
@jc-m @nerdalert 
I am still seeing this issue when trying to use ipvlan in L3 mode. I have added disable default gw setting in docker network create command as well.
docker: Error response from daemon: Cannot start container 2dcb35966fcce550050fbe0e781c7328e94a6cd68953536e68cc1a9c375c253f: [9] System error: failed to set gateway while updating gateway: file exists.

Can you please help me, I am not sure what am I missing. 
Steps:
*_Step 1 *_\- Run ipvlan binary:
./ipvlan-docker-plugin-0.2-Linux-x86_64 -d --mode="l3" --ipvlan-subnet="192.169.57/24" --host-interface="enp0s3" --gateway="192.169.57.1"&

**Step 2** - Create Docker network:
docker network  create  -d ipvlan  --subnet=192.169.57.0/24 --gateway=192.169.57.1 -o host_iface=enp0s3 -o mode=l3  -o com.docker.network.driver.disable_default_gateway net1

DEBU[0015] Network Create Called: [ {NetworkID:5a6c6ff0a97e9cf712165a6670445b55995c232e7528e521ae0a2f44f3ebaf48 Options:map[com.docker.network.generic:map[com.docker.network.driver.disable_default_gateway: host_iface:enp0s3 mode:l3]] IpV4Data:[{AddressSpace: Pool:192.169.57.0/24 Gateway:192.169.57.1/24 AuxAddresses:map[]}] ipV6Data:[]} ]
DEBU[0015] Libnetwork Opts Sent: [ com.docker.network.driver.disable_default_gateway ] Value: [  ]
DEBU[0015] Libnetwork Opts Sent: [ host_iface ] Value: [ enp0s3 ]
DEBU[0015] Libnetwork Opts Sent: [ mode ] Value: [ l3 ]
DEBU[0015] Ipvlan mode is L3 [ l3 ]
DEBU[0015] Adding route for the local ipvlan subnet [ 192.169.57.0/24 ] in the default namespace using the specified host interface [ enp0s3]

**Step 3**: Start the contaiener, this is where it fails -
docker run --net=net1 -it --rm myubuntu bash DEBU[0019] The container subnet for this context is [ 192.169.57.2/24 ]
INFO[0019] Allocated container IP: [ 192.169.57.2/24 ]
DEBU[0019] Create endpoint response: &{Interface:{Address: AddressIPv6: MacAddress:7a:42:00:00:00:00}}
DEBU[0019] Create endpoint 1410ccd52f0b32401bebf404caedb68a3753613d302d917d48886f9b624f6cb5 &{Interface:{Address: AddressIPv6: MacAddress:7a:42:00:00:00:00}}
DEBU[0019] Join request: &{NetworkID:5a6c6ff0a97e9cf712165a6670445b55995c232e7528e521ae0a2f44f3ebaf48 EndpointID:1410ccd52f0b32401bebf404caedb68a3753613d302d917d48886f9b624f6cb5 SandboxKey:/var/run/docker/netns/0add445bda28 Options:map[]}
INFO[0019] Created ipvlan link: [ 1410c ] with a mode: [ l3 ]
DEBU[0019] Join response: &{Gateway: InterfaceName:{SrcName:1410c DstName: DstPrefix:eth} StaticRoutes:[0xc8201ab830] DisableGatewayService:false}
DEBU[0019] Join endpoint 5a6c6ff0a97e9cf712165a6670445b55995c232e7528e521ae0a2f44f3ebaf48:1410ccd52f0b32401bebf404caedb68a3753613d302d917d48886f9b624f6cb5 to /var/run/docker/netns/0add445bda28
DEBU[0020] Leave request: &{NetworkID:5a6c6ff0a97e9cf712165a6670445b55995c232e7528e521ae0a2f44f3ebaf48 EndpointID:1410ccd52f0b32401bebf404caedb68a3753613d302d917d48886f9b624f6cb5 Options:map[]}
DEBU[0020] Leave 5a6c6ff0a97e9cf712165a6670445b55995c232e7528e521ae0a2f44f3ebaf48:1410ccd52f0b32401bebf404caedb68a3753613d302d917d48886f9b624f6cb5
DEBU[0020] Delete endpoint request: &{NetworkID:5a6c6ff0a97e9cf712165a6670445b55995c232e7528e521ae0a2f44f3ebaf48 EndpointID:1410ccd52f0b32401bebf404caedb68a3753613d302d917d48886f9b624f6cb5}
DEBU[0020] Delete endpoint 1410ccd52f0b32401bebf404caedb68a3753613d302d917d48886f9b624f6cb5
DEBU[0020] The requested interface to delete [ 1410c ] was not found on the host: route ip+net: no such network interface
ERRO[0020] The requested interface to delete [ 1410c ] was not found on the host.
docker: Error response from daemon: Cannot start container 2dcb35966fcce550050fbe0e781c7328e94a6cd68953536e68cc1a9c375c253f: [9] System error: failed to set gateway while updating gateway: file exists.

Thanks

**Comment by nerdalert** [comment]
Hey @shmurthy62  @jc-m ! Wanted to send this PR to you guys since you have been so helpful and patient on ipvlan issues. We are close to getting it into libnetwork natively. There is a link in the PR notes if you want to download the binary or compile it and give it a go. Thanks again, will be happy to get this in natively and then we can start doing fun state distribution and services! Thanks again for your input!
https://github.com/docker/libnetwork/pull/964
